{
    "permanentBaleIdentification": {
      "ginCodeNumber": "14842",
      "ginBaleNumber": "3188009"
	},
	"classificationDate": {
		"classedDate": "2019-01-07",
		"cropYear": "2018" 
	},
	"baleReceiving": {
		"receivingType": "2",
		"moduleTrailerNumber": "11111",
		"baleCount": 25
	},
	"baleClassing": {
		"colorGrading": {
			"officialColorGrade": "11",
			"instrumentColorGrade": "11",
			"colorRd": 43,
			"colorPlusB": 16.1
		},
		"stapleLength": {
			"length32": 33,
			"length100": 1.03
		},
		"micronaire": 4.1,
		"strength": 31.1,
		"leafGrade": "5",
		"extraneousMatter": "02",
		"trashPercentArea": 10,
		"lengthUniformityIndex": 78,
		"cottonType": "1",
		"recordType": "0",
		"recordStatus": "1",
		"cccLoanPoints": -45676
	}
}